{
  "schemaVersion": 1,
  "traceId": "inventory.stack.contract-v1",
  "detectorId": "inventory.stack",
  "seed": 74071,
  "build": {"gameVersion": "V3.3.0-b18", "hookManifestHash": "UNVERIFIED"},
  "mode": "observe",
  "determinism": {
    "startUtc": "2026-07-21T12:00:00.000Z",
    "startMonotonicMs": 0,
    "fingerprint": "b72add43780de8635827c5944197ded96afcccf7963c75a64385d6f81b245a4c"
  },
  "workBudget": {"maxEvents": 4, "maxStateEntries": 8, "maxWorkUnits": 32},
  "cases": [
    {
      "name": "normal.at-stack-limit",
      "class": "normal",
      "events": [
        {"sequence": 1, "tick": 100, "type": "inventory.transaction", "sessionEpoch": 1, "containerVersion": 7, "values": {"claimedDestinationQuantity": 50}, "authoritative": {"itemStackLimit": 50}}
      ],
      "expect": {"findingDetectorIds": [], "actions": [], "maxWorkUnits": 8}
    },
    {
      "name": "violation.stack-overflow",
      "class": "violation",
      "events": [
        {"sequence": 1, "tick": 200, "type": "inventory.transaction", "sessionEpoch": 2, "containerVersion": 11, "values": {"claimedDestinationQuantity": 100}, "authoritative": {"itemStackLimit": 50}}
      ],
      "expect": {"findingDetectorIds": ["inventory.stack"], "actions": [], "maxWorkUnits": 8}
    }
  ]
}
